chapter_code|category_code|subcategory_code|title
I|82|9|Acute embolism and thrombosis of unspecified vein
I|82|9|Chronic embolism and thrombosis of unspecified vein
I|83|1|Varicose veins of unspecified lower extremity with inflammation
I|83|1|Varicose veins of right lower extremity with inflammation
I|83|1|Varicose veins of left lower extremity with inflammation
I|83|9|Asymptomatic varicose veins of unspecified lower extremity
I|83|9|Asymptomatic varicose veins of right lower extremity
I|83|9|Asymptomatic varicose veins of left lower extremity
I|83|9|Asymptomatic varicose veins of bilateral lower extremities
I|85|0|Esophageal varices without bleeding
I|85|0|Esophageal varices with bleeding
I|85|1|Secondary esophageal varices without bleeding
I|85|1|Secondary esophageal varices with bleeding
I|86|0|Sublingual varices
I|86|1|Scrotal varices
I|86|2|Pelvic varices
I|86|3|Vulval varices
I|86|4|Gastric varices
I|86|8|Varicose veins of other specified sites
I|87|1|Compression of vein
I|87|2|Venous insufficiency (chronic) (peripheral)
I|87|8|Other specified disorders of veins
I|87|9|Disorder of vein, unspecified
I|88|0|Nonspecific mesenteric lymphadenitis
I|88|1|Chronic lymphadenitis, except mesenteric
I|88|8|Other nonspecific lymphadenitis
I|88|9|Nonspecific lymphadenitis, unspecified
I|89|0|Lymphedema, not elsewhere classified
I|89|1|Lymphangitis
I|89|8|Other specified noninfective disorders of lymphatic vessels and lymph nodes
I|89|9|Noninfective disorder of lymphatic vessels and lymph nodes, unspecified
I|95|0|Idiopathic hypotension
I|95|1|Orthostatic hypotension
I|95|2|Hypotension due to drugs
I|95|3|Hypotension of hemodialysis
I|95|8|Postprocedural hypotension
I|95|8|Other hypotension
I|95|9|Hypotension, unspecified
I|96|-|Gangrene, not elsewhere classified
I|97|0|Postcardiotomy syndrome
I|97|2|Postmastectomy lymphedema syndrome
I|97|3|Postprocedural hypertension
I|97|4|Intraoperative hemorrhage and hematoma of a circulatory system organ or structure complicating other procedure
I|97|5|Accidental puncture and laceration of a circulatory system organ or structure during a circulatory system procedure
I|97|5|Accidental puncture and laceration of a circulatory system organ or structure during other procedure
I|97|8|Other intraoperative complications of the circulatory system, not elsewhere classified
I|97|8|Other postprocedural complications and disorders of the circulatory system, not elsewhere classified
I|99|8|Other disorder of circulatory system
I|99|9|Unspecified disorder of circulatory system
